{
  "skill_id": "seo.public-discovery",
  "version": "1.0.0-draft",
  "status": "draft",
  "source_pins": [
    {
      "source_id": "robots",
      "source_class": "normative_official",
      "uri": "https://www.rfc-editor.org/rfc/rfc9309.txt",
      "revision_sha256": "f633915daaa15b943cae56545d333bcf3ba4d156599e4555499686d6699fb207",
      "excerpt_sha256": "a80cb50ce30f5ccb1578beeaa48db6efafe30516191051e7a77beb493b50f9aa",
      "locator": "The Robots Exclusion Protocol"
    },
    {
      "source_id": "sitemap",
      "source_class": "normative_official",
      "uri": "https://developers.google.com/search/docs/crawling-indexing/sitemaps/build-sitemap",
      "revision_sha256": "e63eaf4eddad9e17772c834c0ffea8f206b45971b25e49fec7c9e5fe63efe315",
      "excerpt_sha256": "50d3e226ae519f4359cde1701baae2f77b9f651f5f827bb9c33c280297efd8cb",
      "locator": "Google supports the sitemap formats"
    }
  ],
  "last_verified": "2026-09-15T02:46:37Z",
  "freshness_deadline": "2026-09-16T02:46:37Z",
  "applicability": {
    "archetypes": [
      "local_service",
      "hybrid"
    ],
    "page_types": [
      "home",
      "service",
      "about",
      "contact"
    ],
    "languages": [
      "en"
    ],
    "on_unknown": "provisional"
  },
  "capability_dependencies": [
    "CAP-CRW-01"
  ],
  "evidence_requirements": [
    {
      "kind": "site_scope",
      "minimum_count": 1,
      "max_age_seconds": 86400,
      "coverage": "partial_allowed",
      "on_missing": "abstain"
    }
  ],
  "procedure": [
    {
      "step_id": "evaluate",
      "operation": "discover_v1",
      "executor": "deterministic",
      "tool_id": null,
      "input_kinds": [
        "site_scope"
      ],
      "output_kind": "records",
      "on_failure": "abstain"
    }
  ],
  "output_schema": "https://schemas.aios-seo.invalid/v1/skill-output.schema.json",
  "tool_permissions": [
    {
      "tool_id": "http.fetch_public",
      "version": "1.0.0",
      "max_calls": 750
    },
    {
      "tool_id": "robots.evaluate",
      "version": "1.0.0",
      "max_calls": 750
    },
    {
      "tool_id": "sitemap.parse",
      "version": "1.0.0",
      "max_calls": 750
    },
    {
      "tool_id": "html.extract",
      "version": "1.0.0",
      "max_calls": 750
    }
  ],
  "external_authority": "read_only",
  "forbidden_behavior": [
    "website_write",
    "submission",
    "credential_access",
    "cross_tenant",
    "source_fabrication",
    "shell_execution"
  ],
  "policy_constraints": [
    "discovery-v1",
    "local-synthetic-v1"
  ],
  "validation": [
    "schema",
    "scope",
    "evidence",
    "freshness"
  ],
  "fixtures": [
    "static-service"
  ],
  "negative_fixtures": [
    "private-redirect"
  ],
  "evaluation_gates": [
    "Q01",
    "Q02",
    "Q03"
  ],
  "deprecation": null,
  "revocation": null,
  "replacement": null
}
